{
  "$schema": "../rubric.schema.json",
  "rubric_id": "mortgage.security.pledge_and_warning_note",
  "version": "1.0.0",
  "status": "DRAFT_FOR_IMPLEMENTATION",
  "priority": "P1",
  "name_he": "רישום משכון, דו״חות עיון והערת אזהרה לטובת הבנק",
  "name_en": "Pledge registration, Pledges-Registrar inspection reports and warning note",
  "description": "Completion-stage collateral evidence the customer uploads in Tefahot Touch (MZ-05): a Pledges-Registrar inspection report for EACH applicant after the pledge is registered, and — second-hand purchase registered in the seller's name — a post-registration registry extract showing the warning note in favour of Mizrahi-Tefahot and also in favour of the buyers, plus the registration confirmation. VisionTrace checks that the documents say what the bank needs; registration itself is the lawyer's/bank's act.",
  "scope": "document_set",
  "document_category": "collateral_registration",
  "applies_to": {"doc_types": ["pledge_inspection_report", "pledge_registration_confirmation", "land_registry_extract_post_registration", "warning_note_registration_confirmation"], "requirement_codes": ["SEC.PLEDGE_INSPECTION_REPORT", "SEC.WARNING_NOTE_BANK"], "party_roles": ["borrower", "co_borrower"], "employment_types": ["*"], "transaction_types": ["second_hand_purchase", "new_construction_purchase"]},
  "preconditions": [{"id": "PRE-01", "text_he": "מצב הרישום של הנכס ידוע (MZ-04): משכון נדרש לנכסים ברמ״י/חברה משכנת ולנכס יד שנייה הרשום ע״ש המוכר; הערת אזהרה לטובת הבנק — יד שנייה רשום בטאבו ע״ש המוכר.", "on_unmet": "NEEDS_REVIEW (לא ידוע אילו מסמכים חלים)."}],
  "required_fields": ["subject_id", "report_datetime", "pledges", "warning_notes"],
  "decisive_fields": ["subject_id", "pledges.creditor", "warning_notes.beneficiary"],
  "field_lexicon": {"inspection_title": ["דו״ח עיון", "תוצאות עיון", "רשם המשכונות", "עיון בשעבודים ומשכונות"], "creditor": ["נושה", "בעל המשכון", "לטובת"], "bank_names": ["בנק מזרחי טפחות", "בנק מזרחי-טפחות", "מזרחי טפחות"]},
  "policy_parameters": [{"name": "inspection_report_per_applicant", "value": true, "status": "CONFIRMED_PUBLIC_SOURCE", "source_ref": "MZ-05", "note_he": "'יש להפיק דו״ח עיון מרשם המשכונות לכל אחד ממבקשי המשכנתא'."}],
  "evidence_policy": {"verified_witnesses": ["text_layer_exact", "ocr_token_match", "vision_reread_confirmed"], "decisive_fields_must_be_verified": true, "citation_rule_he": "כל משכון/הערה מצוטט מהשורה שלו.", "pages_in_scope": "all"},
  "allowed_inference_he": ["לקבוע שדו״ח העיון מציג משכון לטובת מזרחי־טפחות על זכויות בנכס.", "לקבוע שהנסח מציג הערת אזהרה לטובת הבנק ולטובת הקונים."],
  "prohibited_inference_he": ["לקבוע שהרישום תקף משפטית או בדרגה מסוימת.", "לרשום משכון או הערה בשם הלקוח."],
  "missing_data_treatment": {"absent": "דו״ח ללא משכון לטובת הבנק → SEC-INS-03 FAIL.", "illegible": "→ INSUFFICIENT_EVIDENCE.", "ambiguous": "כמה משכונים לאותו נושה → כולם נרשמים.", "unverified": "→ NEEDS_REVIEW."},
  "criteria": [
    {"id": "SEC-INS-01", "title_he": "דו״ח עיון לכל אחד ממבקשי המשכנתא", "dimension": "completeness", "method": "deterministic", "severity": "blocking", "deterministic_logic": "for each borrower/pledgor: ∃ VALID pledge_inspection_report with subject_id == party id → ok; missing → FAIL per party.", "pass_when": "לכל מבקש יש דו״ח.", "fail_when": "חסר דו״ח למבקש.", "needs_review_when": "לא רלוונטי.", "insufficient_evidence_when": "לא רלוונטי.", "reason_code": "PLEDGE_INSPECTION_REPORT_MISSING", "on_fail": "NEEDS_REVIEW", "finding": {"code": "PLEDGE_INSPECTION_REPORT_MISSING", "key_template": "PLEDGE_INSPECTION_REPORT_MISSING:{party_id}", "review_state": "CUSTOMER_ACTION_REQUIRED", "customer_message_he": "חסר דו״ח עיון מרשם המשכונות על שם {first_name}. אפשר להפיק אותו באתר gov.il ('עיון בשעבודים ומשכונות') ולהעלות כאן.", "internal_message_he": "אין דו״ח עיון ל־{party_id}.", "requested_item_template": "pledge_inspection_report:{party_id}"}, "escalation": "customer", "requirement_basis": "CONFIRMED_PUBLIC_BANK_REQUIREMENT", "source_refs": ["MZ-05", "MZ-06"]},
    {"id": "SEC-INS-02", "title_he": "נושא הדו״ח הוא הלווה", "dimension": "identity_binding", "method": "deterministic", "severity": "blocking", "deterministic_logic": "subject_id == assigned party id.", "pass_when": "תואם.", "fail_when": "אדם אחר.", "needs_review_when": "לא מאומת.", "insufficient_evidence_when": "לא מודפס.", "reason_code": "BORROWER_MISMATCH", "on_fail": "INVALID", "finding": null, "escalation": "customer", "requirement_basis": "PROPOSED_VALIDATION"},
    {"id": "SEC-INS-03", "title_he": "הדו״ח מציג משכון לטובת מזרחי־טפחות", "dimension": "completeness", "method": "hybrid", "severity": "major", "deterministic_logic": "pledges where creditor matches bank_names → PASS; none → FAIL(PLEDGE_NOT_SHOWN) — usually the report was produced before registration; report_datetime < pledge registration datetime (if known) → NEEDS_REVIEW.", "pass_when": "משכון לטובת הבנק מופיע.", "fail_when": "אין משכון לטובת הבנק.", "needs_review_when": "הדו״ח הופק לפני מועד הרישום.", "insufficient_evidence_when": "טבלה לא קריאה.", "reason_code": "PLEDGE_NOT_SHOWN", "on_fail": "NEEDS_REVIEW", "finding": {"code": "PLEDGE_NOT_SHOWN", "key_template": "PLEDGE_NOT_SHOWN:{document_id}", "review_state": "CUSTOMER_ACTION_REQUIRED", "customer_message_he": "בדו״ח העיון שהועלה עדיין לא מופיע המשכון לטובת הבנק. ייתכן שהדו״ח הופק לפני הרישום — אפשר להפיק דו״ח עדכני.", "internal_message_he": "משכונים בדו״ח: {pledges}.", "requested_item_template": "pledge_inspection_report:{party_id}"}, "escalation": "customer", "requirement_basis": "CONFIRMED_PUBLIC_BANK_REQUIREMENT", "source_refs": ["MZ-05"]},
    {"id": "SEC-WRN-01", "title_he": "בנסח שאחרי הרישום רשומה הערת אזהרה לטובת הבנק", "dimension": "completeness", "method": "hybrid", "severity": "blocking", "deterministic_logic": "post-registration extract: warning note with beneficiary matching bank_names → PASS; none → FAIL(WARNING_NOTE_BANK_MISSING).", "pass_when": "הערה לטובת הבנק רשומה.", "fail_when": "אין הערה לטובת הבנק.", "needs_review_when": "הנסח הופק לפני מועד הרישום.", "insufficient_evidence_when": "לא נקרא.", "not_applicable_when": "מצב רישום שאינו דורש הערה לטובת הבנק (MZ-04).", "reason_code": "WARNING_NOTE_BANK_MISSING", "on_fail": "NEEDS_REVIEW", "finding": {"code": "WARNING_NOTE_BANK_MISSING", "key_template": "WARNING_NOTE_BANK_MISSING:{document_id}", "review_state": "CUSTOMER_ACTION_REQUIRED", "customer_message_he": "בנסח שהועלה לא רשומה הערת אזהרה לטובת הבנק. עורך הדין של המוכרים רושם אותה — אפשר לבדוק איתו ולהעלות נסח מעודכן.", "internal_message_he": "הערות בנסח: {notes}.", "requested_item_template": "land_registry_extract_post_registration"}, "escalation": "customer", "requirement_basis": "CONFIRMED_PUBLIC_BANK_REQUIREMENT", "source_refs": ["MZ-04", "MZ-05"]},
    {"id": "SEC-WRN-02", "title_he": "רשומה גם הערת אזהרה לטובת הקונים", "dimension": "completeness", "method": "hybrid", "severity": "major", "deterministic_logic": "warning note with beneficiaries ⊇ buyers (ids) → PASS; else FAIL(WARNING_NOTE_BUYERS_MISSING).", "pass_when": "הערה לטובת הקונים רשומה.", "fail_when": "אין הערה לטובת הקונים.", "needs_review_when": "רק חלק מהקונים.", "insufficient_evidence_when": "לא נקרא.", "reason_code": "WARNING_NOTE_BUYERS_MISSING", "on_fail": "NEEDS_REVIEW", "finding": null, "escalation": "customer", "requirement_basis": "CONFIRMED_PUBLIC_BANK_REQUIREMENT", "source_refs": ["MZ-04", "MZ-05"]}
  ],
  "verdict_policy": {"rules_he": ["רובריקת סט; verdict מסמך לפי SEC-INS-02 ו־CLS."], "set_status_rules_he": ["FAIL חוסם → INCOMPLETE; NEEDS_REVIEW → NEEDS_REVIEW; אחרת COMPLETE."]},
  "cross_document_dependencies": [{"rubric_or_doc": "mortgage.land_registry_extract", "relation_he": "קריאת הנסח."}, {"rubric_or_doc": "mortgage.purchase_agreement.extraction_consistency", "relation_he": "רשימת הקונים."}],
  "examples": [
    {"label": "valid", "situation_he": "שני דו״חות עיון (עידו, נועה) המציגים משכון לטובת בנק מזרחי טפחות; נסח עם הערות לטובת הבנק ולטובת הקונים.", "expected": {"all": "PASS"}},
    {"label": "invalid", "situation_he": "הוגש דו״ח עיון רק לעידו.", "expected": {"SEC-INS-01": "FAIL", "finding": "PLEDGE_INSPECTION_REPORT_MISSING:BRW-B"}},
    {"label": "uncertain", "situation_he": "דו״ח עיון שהופק שעה לפני רישום המשכון.", "expected": {"SEC-INS-03": "NEEDS_REVIEW"}}
  ],
  "expected_response": {"schema_ref": "../../D_VISIONTRACE_REVIEW_DATA_CONTRACTS/schemas/mortgage-review.v1.schema.json#/$defs/SetReview"},
  "source_refs": ["MZ-04", "MZ-05", "MZ-06"],
  "changelog": [{"version": "1.0.0", "date": "2026-10-12", "change_he": "טיוטה ראשונה."}]
}
